{
  "$schema": "http://json-schema.org/draft-04/schema#",
  "id": "applicationEntitlement.json",
  "title": "Application Entitlement Flow Schema",
  "description": "An entitlement flow result for a single application",
  "type": "object",
  "properties": {
    "id": {
      "description": "An application entitlement flow identifier",
      "type": "string",
      "format": "uuid"
    },
    "applicationId": {
      "description": "An application descriptor identifier",
      "type": "string"
    },
    "tenantId": {
      "description": "A tenant identifier",
      "type": "string",
      "format": "uuid"
    },
    "flowId": {
      "description": "An entitlement flow identifier",
      "type": "string",
      "format": "uuid"
    },
    "type": {
      "description": "Application flow entitlement type",
      "$ref": "types/entitlementType.json"
    },
    "status": {
      "description": "Application flow execution status",
      "$ref": "types/executionStatus.json"
    },
    "startedAt": {
      "description": "An application flow start timestamp",
      "type": "string",
      "format": "date-time"
    },
    "finishedAt": {
      "description": "An application flow end timestamp",
      "type": "string",
      "format": "date-time"
    },
    "stages": {
      "description": "A list with executed stage results",
      "type": "array",
      "items": {
        "$ref": "flowStage.json"
      }
    }
  }
}
